unique_id,condition,awareness_1_out_of_ordinary,awareness_1_systematic,fazio_and_olsen_criteria_scorer_1,fazio_and_olsen_modified_criteria_scorer_1,fazio_and_olsen_criteria_scorer_2,fazio_and_olsen_modified_criteria_scorer_2
Kurdi and Ferguson_46,CS1_USpos, some pairs occur frequently,"sometimes two objects, sometimestwo words, the location of words varies",,,,
Kurdi and Ferguson_47,CS1_USneg,i began to notice that pairs of words and images continued to pop up together.,i noticed that the wordds with the same first letter as the word i was supposed to be looking for popped up way more.,,,,
Kurdi and Ferguson_48,CS1_USneg,"not particu;alarly, no, other than a series of disturbing images","to some extent yes, for example glassess often appeared with some cube",,,,
Kurdi and Ferguson_49,CS1_USpos,they were presented in different parts of the screen and sometimes associated with words or images that were similar most likley in an effort to see how good the brain is alctrlt distinguishing close imagesslash or words.,"yes, words and images that were similar were often grouped together.",,,,
Kurdi and Ferguson_5,CS1_USpos,"the words in the beginning were spaced very close together, almost as if it were one word or a compound word.","many of the words and images appeared in groups, for example 'ppencil' and 'book' appeared together often, similar to the fan and the hairdryer.",,,,
Kurdi and Ferguson_50,CS1_USneg,"ii noticed the same few images, then there were some images that only appeared once. an example of this was the person throwing up in the toilet.","i noticed that there were words that kept appearing, such as concrete, computer, and glasses.",,,,
Kurdi and Ferguson_51,CS1_USneg,"it seemed to me that the pictures and words were not randomly assigned, they appeared in the same order and within the same interval of time 9. that is how it felt for me.","yes, it seems the words and images were presented systematically",,,,
Kurdi and Ferguson_52,CS1_USpos,pictures of unrelated things like fans popped up as well as words that were irrelevant such as glasses,images repeated frequently and in a very similar rotation,,,,
Kurdi and Ferguson_53,CS1_USpos,"the images changed positions on the screen constantly. conflicting words and images were paired. sometimes the target word was displayed with the image, sometimes not.","sowords that might associate together 9like book and pencil were used, and also split up. not entirely random words. ",,,,
Kurdi and Ferguson_54,CS1_USpos," i did not particularly notice something that is out of ordinary.  few imges that kept repeating, like the fan and other cartoon characters were something that i noticed. there were some new wordsslash and images that were added in different sessions s, like a man near the toiletslashslashslash",often the image of a cup was appeared together with the word 'concrete'. i also noticed that the two image of fans were also appeared together.,,,,
Kurdi and Ferguson_55,CS1_USpos,"the same words and images kept appearing, such as book, pencil, etc.",some pictures are accocssociated with positive words and some appear with negative words.,,,,
Kurdi and Ferguson_56,CS1_USneg,"the ere were patterns in the way in which words appeared upon the sceen.  for example, a word could be paired with another word and then a different word could appear after that word pair","a word could be matched to another word, and image , or by itself  or on a different location on the page. the images mainly appeared on the center of the screen",,,,
Kurdi and Ferguson_57,CS1_USneg, i thought it was strange that the glass was paired with the word 'concrete' multiple times. ,"yes, some words were paired up with the same pictures. and some words were never paired up with pictures like 'pencils'.",,,,
Kurdi and Ferguson_58,CS1_USpos,"some of the words began with the same letter or contained similar letters to what the target was, there seemed to be more repetition of some wordsslashslash and images more than others.","the images and words that appeared in the second task was similar to the ones that appeared during the first task. again, there were some word that contained letters similar to those in the target word.",,,,
Kurdi and Ferguson_59,CS1_USneg,i found it a bit strange that the word was also present with the image. my eyes would dart to the word initially even if the image was there 9just to double check.,"the first few times tended to show the target imediately both image and word but after a few runs, the target would not be shown as frequently in the beginning but rather just once. there were long pauses with no images that made me tense up and when the target showed up repeatedly, i was caught off guard once. there would also be long times where the target would not show up and i questioned if i had missed it.",,,,
Kurdi and Ferguson_6,CS1_USpos,the target always appeared with its name,towards the end i feel like there were more cartoon characters thrown in,,,,
Kurdi and Ferguson_60,CS1_USpos,"the gray creature was always bracketleftpaired with negative words or images and the blue one 9frillish was paired with positive words or images. the green and yellow one was bracketleftpaired with neutral words. pencil and book were paired together a lot. many times, when the target word was presented once it was presented again right after.",the gray creature was systematically placed with negative wordsslash and pictures and the blue frillish one was placed with positive words and pictures.,,,,
Kurdi and Ferguson_61,CS1_USneg,i did not notice anything out of th e ordinary,not reallyy. nothing besides some pictures repeated a lot,,,,
Kurdi and Ferguson_62,CS1_USneg,frillish seemed to have a lot of negative imagery whenever leftleftleftleftleftit appeared ,the frillish thing from before and also the opposite was in a way happening with magearna but wih positive imagery,,,,
Kurdi and Ferguson_63,CS1_USneg,the words and pictures were presented in random places or side by side. nothing out of the ordinary ,i dont remember what pictures were paired but i do remember that the pairings were the same most of the time ,,,,
Kurdi and Ferguson_64,CS1_USpos,"no, the words and pictures seemed to be presented in a relatively randomslashslash and hard to predict way.","i thought that they were following the same order in each task at one point, but later decided that it was not systematic.",,,,
Kurdi and Ferguson_65,CS1_USpos,"most of them were matched with something that either matches it or is slightly opposite, like book and pencil.  ",smost of the words were repeated throughout the experiment,,,,
Kurdi and Ferguson_66,CS1_USneg,tthe photos had themes of householdslash daily items ,the fan and hairdryer appeared frequently and the words that appeared were mainly describing a state of being or feeling,,,,
Kurdi and Ferguson_67,CS1_USneg,it seems like theach task started off more sraightforward in terms of identifying the pokemon and got trickier as it progressed.,see first answer where the identfying starts off easier.,,,,
Kurdi and Ferguson_68,CS1_USpos,i did not notice anything particularly out of the ordinary in the way the words and pictures were pbracketleftresented during the task. ,i did not notice anything systematic.,,,,
Kurdi and Ferguson_69,CS1_USpos,"the words and images were presented in random areas of the screen. for some of the wordsslashslash and images, the word would appear, and then it would grow slightly larger on the screen, but i did not notice this for all of them.","many of the words are images appeared together, like pencil was often next to book, and some of the same images always came together. the words and images would leave the screen at the same time.",,,,
Kurdi and Ferguson_7,CS1_USpos,"repetitive imageslashe and word combinationsss, noticed magearna slash was paired with negative images or words, the other blue thing was always positive, and the yellow thing was always with concrete","i think i may have inadvertently answered this in the previous question but yes, there were repetitive motifs, like certain characters were always with negativeslash or positive words or images",,,,
Kurdi and Ferguson_70,CS1_USpos,"i did not notice anything unusual, except i was expecting the old targets to appear again, but they never did. ","i was not attempting to focus on any trends, but i did start to pick up on minor things as the experiment went on.",,,,
Kurdi and Ferguson_71,CS1_USpos,there was along response time in between when the images would be displayed and that was not consistent. ,for the character that started with an 'm' it was clear that that character was being targeted with negative words. ,,,,
Kurdi and Ferguson_73,CS1_USpos,presented similar words as target figure,word w rword then picture with picture then word with picture ws presented.,,,,
Kurdi and Ferguson_74,CS1_USneg,the words would appear on different parts of the screen. occasionally the screen would go white for a few secondsslash . the pictures and words had no correspondance to each other.,i only noticed the words bracketleftpencil and book appearing systeatically. those were the only words that stood out and that i rememeber.backslash,,,,
Kurdi and Ferguson_75,CS1_USneg,there are good or bad words associating with the image. ,i don't rea;;;;lly notice the pattern.,,,,
Kurdi and Ferguson_76,CS1_USneg,some characters are linked to bad words,"some cartoon characters are linked to bad words, while others are linked to good words",,,,
Kurdi and Ferguson_77,CS1_USneg,"it seemed like there was a story with some pictures of a child growing up, graduating,and dyingslashslash. the pictures were random but repetative 99like the fan, blow dryer, cup, grid, etc.",the fan and blow dryer were together a lot. and the grid and mug were together fairly often. concrete also came up many times but i do not recall what it was paired with. the story of the boy was also chronological.,,,,
Kurdi and Ferguson_78,CS1_USpos,there were many images that had a tendency to appear together.,"yes, there were certain images that were more likely to appear together than others.",,,,
Kurdi and Ferguson_79,CS1_USpos,the fish pokemon was ony prsented with positive images and words. the blackslashdark pokemon was only presented with negative images and words. t,glass and cup together a lot. glasses and concrete together alot,,,,
Kurdi and Ferguson_8,CS1_USneg,the pacing as to how frequently the targets appeared was varied. most of the images and words were repeated many times but some only appeared once.,"most of the time the target image and word would appear together, sometimes the target word would appear alone. sometimes multiple imagesslashword and words would appear at the same time for a bit, sometimes they would be staggered.. the words and imaes remained on the screen for about an equal amount of time before something changed",,,,
Kurdi and Ferguson_80,CS1_USneg,no. i noticed that there was some repetition.,"i noticed as the stages progressed, the images got a little more strange and so did the words. the words started becoming more 'strong'.",,,,
Kurdi and Ferguson_81,CS1_USpos,npossibly the time between each oneslash or the location of the stimuli across the screen,location for each image,,,,
Kurdi and Ferguson_82,CS1_USpos,many of the characters were presented with words from the same specific categories.  magearena was constantly presented with negative words while frillish was always next to a positive one.,"as previously mentioned, word association was clearly present.  but, certain images were placed in the same spots repeatedly throughout the experiment.",,,,
Kurdi and Ferguson_83,CS1_USneg,iii noticed that there were a repetition of words and images,they were clustered in one area together,,,,
Kurdi and Ferguson_84,CS1_USneg,"words with positive connotations were paired with images of magearna and words with negative connotations as well as images with negative connotations were presented with frillish. also, certain images were constantly paired together i.e. the glass with the green and yellow pokemon...","as stated before, negative images and words were paired with frillish and positive words and images were paired with magearna. the image of the fan was also constantly paired with the blowdryer and the word concrete was frequently paired with scraggy.",,,,
Kurdi and Ferguson_85,CS1_USpos,i thought some wordslash andslashd pictures are paired and often presented togetherr.,some pictures were matched and also a picture was associated with a certain word frequently.,,,,
Kurdi and Ferguson_86,CS1_USpos,"some of the images were not just generic, but emotional i.e graveyard, but others were ordinary like a glass of water","when the image we were looking for showed up, it would show up multiple times in a row",,,,
Kurdi and Ferguson_87,CS1_USpos,sometimes words appeared on the corners of the screen. the pictures were somtimes reflected when they were presented. many words and pictures were shown repeatedly 9,the target word and target picture appeared together many times. ,,,,
Kurdi and Ferguson_88,CS1_USneg,the same words and pictures were shown in a similar order each time but the object we clicked for was different. ,"yes, it was the same sequence everytime but the object we were clicking for changed.",,,,
Kurdi and Ferguson_89,CS1_USpos,i noticed that words and images were presented at the same time. and often times the words and images were in the middle of the screen. i also found it more difficult when the images i was choosing started with the letter c because there were a few filler words that started with c. ,"i noticed that there were a lot of filler words and images presented before one of the actual picturesslashslash and words were presented for which i would choose. also, when there was a long pause in between words or images popping up it made it harder to recognize the word right away.",,,,
Kurdi and Ferguson_9,CS1_USpos,"they were spread out around the screen, words were under the pictures",no i did not see anything,,,,
Kurdi and Ferguson_90,CS1_USpos,"the pictures of the target were often presented after a few images apppeared on the screen, personally most pictures were at random,  notced nothing out of the ordinary.",the target picture often first appeared alongside its name. the word 'concrete' often appeared next to the class cup. ,,,,
Kurdi and Ferguson_91,CS1_USneg,sometimes the words were right next to each other while sometimes they were farther away from eachother. same thing with pictures they were either close or far away,they seemed very random in the way they were presented. sometimes they were close together sometimes further away. sometimes it was a single word or picture while other times it was 2. the whole thing seemed random in the way it was presented. however they was a time during each surveillance where you would get the target 3 times in a row.,,,,
Kurdi and Ferguson_92,CS1_USpos,"there were positive words put next to the blue, flowy creature and there were negative words put next to a different one 99but i forget what the creature looked like","same as the last answer minus, the flowy blue creature had words like desirable and the other one had pictures of garbage or other negative things",,,,
Kurdi and Ferguson_93,CS1_USpos,i don't specifically remember seeing anything out of the ordinary. some  of the words seemed related to each other like 'pencil' and 'book'.,"some pictures appeared to be paired together a lot, while others were flashed on their own most of the time. some of the words seemed related to each other and others did not. sometimes it seemed like the was an order certain imagesslash and words were shown in.",,,,
Kurdi and Ferguson_94,CS1_USneg,the time intervals between the words and pictures being presented varied.,the hair dryer and fans appeared together frequently.,,,,
Kurdi and Ferguson_95,CS1_USpos,"words were almost always mismatched with their corresponding images, like with the hair dryer being paired with another word.","in some instances, words were paired together with things that are similar to them or are used in simlar contexts, like 'pencil' and 'book' being placed  together.",,,,
Kurdi and Ferguson_96,CS1_USneg,bad words and images were always paired with frillish and good words were paired with mthe robot lady ,"the yellow scraggly one always appeared with concrete, the green squadon one always appeared with neutral words like computer or pitures of glasses",,,,
Kurdi and Ferguson_97,CS1_USneg,they seem to follow a certain pattern of apperance  ,"yes some pictures or words appeared together, and disappeared in a certain fashion or order",,,,
Kurdi and Ferguson_98,CS1_USneg,some unpleasant words were always used with certain creatures,"yes, certain creatures were always paired with positive words and others were always paired with negative words. some were paired with neutral words",,,,
Kurdi and Ferguson_99,CS1_USneg,"i found it slightly offputting when several stimuli would be placed at the center of the screen, and then suddenly the center of focus would shift to one of the corners.  i was also interested in the moments when one of the words or photos would stay on the screen for more than one flash.","i wasn't paying much attention honestly, but i was wondering how the likeability of an image made a difference . when i saw the image of worms for example i could tell that i checked out of the experiment for a second because i wasn't expecting it.",,,,
